Answer,Title,Question,Source
"These components can be split into two functional groups, one for transmitting a picture and one for receiving it, which aren't connected to one another by wires. The Runcam camera and Eachine VTX are both parts of the transmitting section, while the receiver doesn't need to be soldered to anything else in the receiving part.
Required Soldered Connections:
You'll need to make the following wire connections between the different components: (splicing together the components' connector pigtails is recommended as opposed to trying to solder directly to the camera)

Battery+ → VTX 7-24V wire
Battery- → VTX GND wire (there are a total of two available, choose either one)
Battery+ or VTX +5V wire → Runcam 5-36V wire
Battery- or VTX GND wire → Runcam GND wire (in 5-pin camera connector, not the 2-pin camera controller connector)
Runcam Video wire → VTX VIDEO wire

Essentially, both the camera and VTX need to be connected to each other for the analog video signal (one wire) and each need to have connections to ground/GND and a positive voltage source within their requirements.
Battery Setup:
In this setup, the VTX is actually the component that constrains the kind of power sources/batteries you can use. It requires 7-24V to operate, which means you can use 2S-5S LiPo batteries with it. (or another battery pack within the same voltage range)
Most drone/RC LiPo batteries these days come with either an XT30 or XT60 connector, but can be purchased with other terminations. See this page for a list of the most common ones. Once you know what your battery's connector is called, you can purchase a set of connectors online and solder them to the VTX and camera as required.
It's unlikely you'll be able to match the connectors that come with the parts together. While the connectors are all off-the-shelf parts, their usage is unfortunately not really that standardized between manufacturers. You're probably better off just cutting the cable that came with the camera in half and soldering it together with the pigtail wires that come with the VTX.
Once this is done, you can hopefully power on the VTX, camera, and receiver without issues, (remember to screw on the VTX's antenna before powering up so you don't damage it!!!) set the VTX and receiver to the same channel, and view the picture on the connected Android phone/tablet.
Did I leave something out? Please let me know if I did and something doesn't make sense...
",How do I wire up this transmitter and camera,"I'm a total newbie to FPV and electronics. My son bought the following components as an adventure into FPV for his Remote Control vehicles (cars, planes, drones).

Descriptions of the components:
Eachine TX805 5.8G 40CH 25/200/600/800mW FPV Transmitter TX LED Display Support OSD/Pitmode/Smart Audio
https://www.banggood.com/Eachine-TX805-5_8G-40CH-25-or-200-or-600-or-800mW-FPV-Transmitter-TX-LED-Display-Support-OSD-or-Pitmode-or-Smart-Audio-p-1333984.html
RunCam Swift 2 600TVL 1/3 CCD 2.5mm/2.3mm/2.1mm FOV 130/150/165 Degree Mini FPV Camera PAL with MIC Support OSD
https://www.banggood.com/RunCam-Swift-2-600TVL-1-or-3-CCD-2_5mm-or-2_3mm-or-2_1mm-FOV-130-or-150-or-165-Degree-Mini-FPV-Camera-PAL-with-MIC-Support-OSD-p-1118948.html
Eachine ROTG02 UVC OTG 5.8G 150CH Diversity Audio FPV Receiver for Android Tablet Smartphone
https://www.banggood.com/Eachine-ROTG02-UVC-OTG-5_8G-150CH-Diversity-Audio-FPV-Receiver-for-Android-Tablet-Smartphone-p-1242422.html
The transmitter says it takes between 7 and 24V - so the first issue is to find a battery to power this that fits the connector it has. I don't know how to describe the connector it has so I don't know how to find a compatible battery.
Second, from what I understand the transmitter has 5V out to power the camera, but I don't know how I'm supposed to attach the 2 together.
My first objective is to get the transmitter and camera connected, with a battery to power the transmitter - so we can at least get something working. Can anyone help me understand what I need to do?
Thanks in advance...
",https://drones.stackexchange.com/questions/1555/how-do-i-wire-up-this-transmitter-and-camera
"The product page of the helicopter states it is compatible with: FUTABA S-FHSS, expandable satellite receiver, and supports DSMX DSM2 PPM S-SUS
Your TX/RX are from Futaba but from the older FASST system so S-FHSS is no option. DSMX and DSM2 are from Spektrum and not compatible with Futaba.
There are two options remaining: PPM and S-BUS. Both do basically the same: send the signal of all channels via one cable. As far as I can tell your TX does not support either and only allows to send one channel via one output.
S-Bus is also from Futaba so you could try to find a FASST receiver that supports S-Bus output. Frsky also has compatible FASST receivers with PPM output (like FrSKY TFR4-B). Then you could solder a connector from the outputs from the RX to the E160 motherboard. The yellow cable in the picture is the S-BUS/PPM wire, red is 5V and black is ground. To find the correct matching pins on the RX I'd look in the manual. Usually you have some labels on the case.
A PPM enconder is also an option. This is a small board that encodes the servo signals to a single ppm stream. The downside is that you still have many cabels between the encoder and the RX and you need space for an additional board.
",Possible to use Eachine E160 with Futaba T6EX transmitter/receiver set?,"I've inherited a Futaba T6EX transmitter with a Futaba R6106HFC receiver, and now I'm planning to buy an Eachine E160 RC helicopter (BNF version), to be bound to this Futaba set.
However, I'm not sure if the receiver can actually be connected to the motherboard of the E160:
I've found a video that shows how to connect a receiver to the E160's motherboard, but I'm afraid that available DSM and SBUS/PPM ports are not suitable for my Futaba receiver.
",https://drones.stackexchange.com/questions/1564/possible-to-use-eachine-e160-with-futaba-t6ex-transmitter-receiver-set
"There are two parts to mapping with a Mini 2.

Autopilot App - No autopilot apps will work with the Mini 2 until DJI releases the SDK. Expect Dronelink to provide support for the Mini 2 quickly after DJI introduces the SDK.
You'll need a photogrammetry processing software.

Here's two posts I've written examining what maps and accuracy you can expect with the original Mini.  The mini 2 should be similar.

Can I Map and Survey with the Mavic Mini
How Accurate is Mapping with the DJI Mavic Mini

Full Disclosure I'm the founder of Civil Tracker.
",DJI Mini 2 Mapping Capabilities,"I planned to buy my first drone to ease my work. Recently, I found the DJI Mini 2, which I can afford to buy. I've already done some research about drone mapping. Based on my findings on the internet, I could use this technique since it does not require me to install some APK on an android phone. The link is below:
DJI mini mapping tutorial
So, I want to use this technique for my first drone. My question is, can I do this with DJI Mini 2?
Thanks
",https://drones.stackexchange.com/questions/1730/dji-mini-2-mapping-capabilities
"I think yes, this is doable. In this diagram you can replace the ESC Motor 1 with your 4 in 1 iflight ESC. Note that you will probably need to redirect the PWM outputs to your 4 in 1 ESC signal inputs.


Could I provide power to the motors by wiring all of the positive outputs together of the power module

No, no need to do that. Use a single power output of the power board (it is simpler and in certain cases more reliable).
EDIT
Following the discussion in comments, your 4 in 1 ESC already acts as a power distribution board. Depending on your situation, you may not need the power module at all. For example, one could split battery power output into two: one to go directly to 4 in 1 ESC, and another one to an UBEC to get 5V (to power the flight controller).
",Connecting 4 in 1 esc with power module,"I have a 4 in 1 iflight esc currently connected to my motors. I am attempting to interface it with my flight controller (Pixhawk 4), which comes with a power module (https://docs.px4.io/master/en/power_module/holybro_pm07_pixhawk4_power_module.html) in order to provide power to my escs and flight controller. This module has individual power outputs for every motor (each output is supposed to connect to a single esc, while the 4 in 1 esc only has one power input. Could I provide power to the motors by wiring all of the positive outputs together of the power module, and using them as the input to the esc, or would this create issues beyond losing the ability to track the power going to each motor? I am using a quadcopter. Thanks.
",https://drones.stackexchange.com/questions/1836/connecting-4-in-1-esc-with-power-module
"I've had the same thing happen when using these same motors and props (and others). The propeller seems to get stuck at a point where it is not flush with the motor. From my experience, the solution is as simple as tightening it further. I use a tool like this that allows me to apply more force than a typical prop-tightening tool.
It should look like this when fastened correctly, with the prop sitting flush with both the motor bell and the nut:

",Proper rotor fastening (Nyloc nut),"I am trying to figure out how to properly fasten my rotors on my quadcopter. I am pretty sure the nuts are Nyloc, but here is a picture for reference:

I read online in many places that you should just tighten the nut until you can't anymore with your hands, and some people recommended using pliers or socket wrenches. My problem is, no matter what tool I use, the nut will not tighten past the point where its top is flush with the shaft (I don't know much about Nyloc but this seems by design). Here are the motors I am using (https://www.amazon.com/iFlight-2750KV-Brushless-Racing-Quadcopter/dp/B07Y9JK2MW). This first result is what I achieve almost every time after tightening as far as the nut will go:

But this causes issues because I can tip the rotor in different directions with my hand, and so it seems like it would wobble when turning, and the fit is definitely not secure. (I at first thought this was because the 5mm hole in the rotor was too large for the 4mm shaft, but I was told that the threading in the shaft was 5mm so it would be fine). This second result was achieved after inserting two washers between the nut and rotor, tightening down the nut, untightening and removing the washers, and the tightening the nut once more.

I removed the washers because while I had read that some people tighten their rotors with washers, the gap seemed too large for this to be the solution, so I assumed I was doing something incorrectly in the mounting. Where did I go wrong, and how should these rotors be mounted?
",https://drones.stackexchange.com/questions/1865/proper-rotor-fastening-nyloc-nut
"Firstly, in addition to the common European rules, the whole territory of the Czech Republic is located in the LKR10-UAS restricted airspace. That basically means that the older stricter national rules remain in power in addition to the default lax European rules.
Secondly, most of Prague is a densely built area. The UA operation is forbidden with the exception of UAs in the SPECIFIC or CERTIFIED category that are licensed by the CAA (ÚCL). The OPEN category is not allowed. Toys that do not require registration are allowed.
Additionally, the territory of Prague is located in CTR Ruzyně where the rules for UAs in the controlled airport area must be observed. Thankfully, the operation of drones is possible up to 100 m AGL if farther than 5500 m from the airport.
Also, most interesting part of Prague is located in the LKR9 restricted airspace. You cannot operate a UA without an operation approval from the CAA (ÚCL). Do note that you will need the approval for each operation, you will not get a blanket approval to fly there for a week, at best for some specific repeated flights that follow some common pattern regularly.

So realistically, you need to get your drone running in the SPECIFIC or CERTIFIED category in the Czech Republic and to get yourself certified to operate UAs in one of these categories. You wrote you have &quot;a license&quot; but from a certain naivety of the question I have to assume it is actually just a registration of a pilot and drone in the OPEN category, but do correct me if I am wrong.
Be prepared for a lot of paperwork. It is basically meant for professionals conducting for-profit aerial work in the area.
Then you can get approval to operate them also in the LKR9 airspace.
",How to get a licence to fly a drone in the city of Prague for a week?,"I would like to take my drone and go fly in the city of Prague - it's super beautiful there during lockdown. (I'm close by anyway so don't worry, I'm staying safe) But -
According to Czech law it's illegal to fly a drone within city borders. You need to get an extra licence/allowance for that. My own shortcoming is, I cannot speak Czech.
Does anyone of you have any prior experience in getting this licence? I read that you can apply for such a licence, but I neither know where nor how. On the other side, I read that people already got into trouble, especially when flying in Prague (residency of the president, etc. etc.)
I do have a registration and the required European licence to fly a drone. I'm really looking for specific allowance for Prague.
(I already asked in travel and they were kind enough to forward me here)
",https://drones.stackexchange.com/questions/1898/how-to-get-a-licence-to-fly-a-drone-in-the-city-of-prague-for-a-week
"Adding more motors will generally give you more power, meaning you can lift more. You will however need a bigger battery to get the same hover time, since more motors will use more power as well. So there is a trade off between being able to lift a lot, and flying for a longer time.
Another advantage of more motors is that you can maintain maneuverability even if you lose a motor. So if you are carrying some expensive equipment or doing something critical, six or even eight motors might be preferable.
I'm not aware of any simulators that can test this accurately, but you can use this online calculator to test different configurations. I assume that is close to what you want? Most of the options require a payment, but you can probably get an idea of what you want without that.
",What is the advantage of using more motors?,"I am at the beginning of a drone project, which will have a 25 kg MTOW, and I am analyzing whether I use four, six or eigth engines.
Is there a good advantage of using more motors or does it really depend on the project design?
Does anyone know a simulator that can help?
",https://drones.stackexchange.com/questions/1927/what-is-the-advantage-of-using-more-motors
"As you point out, the Teensy 4.0 online documentation mentions that neither the digital GPIO nor analog I/O are 5v-tolerant pins. It appears that the ESCs in the kit you linked to only have a PWM signal input and no bi-directional communication bus (e.g. Bidirectional DSHOT), so the only voltage present on the PWM input line would be one that you create. (thus there is no real danger of the ESC putting 5v on the signal line, though the 5v BEC pin will still have it)
However, you may run into another issue when trying to issue commands to the ESC from the Teensy. Being a 3v3 logic-level device, its logic high may not be sufficient voltage to &quot;trigger&quot; the ESC, depending on how the ESC's software interprets incoming signals. You can address this with a &quot;level converter&quot; (essentially just a set of small BJT transistors to switch 5v lines with 3v3 ones and vice versa) like this one from Amazon.
",what is the voltage output from the ESCs of drone motors?,"the flight controller i am using is a custom one, which is a teensy 4.0 microcontroller. it cannot have more than 3.3V into its GPIO pins. I know I can use the 5V from the BEC of the ESC to power my teensy, but will the digital control pins from the ESC apply more than 3.3V at the pins of the teensy?
this the drone motor (and frame) that i am using.
",https://drones.stackexchange.com/questions/1943/what-is-the-voltage-output-from-the-escs-of-drone-motors
"Most omnidirectional antennae have two factors that work well for them.

1) They have fairly symmetrical and uniform RF profiles. This means that you are less prone to sudden drop-outs in the video as you change the orientation of the antenna as it is less likely that you will line up well with an area of lower RF intensity.

2) They are often circularly polarised, as the mushroom is. This means that that the correct Rx / TX combination effectively cuts out interference from signals reflected from various obstructions, making for a more clean and reliable reception.
",What makes mushroom antennae so good at receiving and transmitting omnidirectionally?,"I've seen many references saying that mushroom antennae (like the one shown below) are excellent at receiving and transmitting omnidirectionally. I have them on my drones' video transmitters and one paired with a patch antenna on my FPV goggles.

What makes them so good at this?


",https://drones.stackexchange.com/questions/98/what-makes-mushroom-antennae-so-good-at-receiving-and-transmitting-omnidirection
"I'm going to assume that you don't need your videos to be stabilised realtime. In this case you need image stabilisation software.

I'm not an expert in this field particularly, so I'll copy the most relevant answers on this reddit thread.


  If it's a smoothing stabilisation like this, you can use VirtualDub
  and Deshaker (Tutorial), Ffmpeg (Tutorial) which are all free or you
  can use After Effects - Tutorial. There's also a Stabilization bot
  called stabbot which will do it for free. Check out r/stabbot. It uses
  Ffmpeg/vid.stab.

",Keep quadcopter steady when taking a video,"Whenever I take a video on my small quadcopter, it’s never steady. It always bounces up and down a bit rather than keeping level. How can this be stopped/prevented?
",https://drones.stackexchange.com/questions/491/keep-quadcopter-steady-when-taking-a-video
"While I'm far from knowledgeable enough to give you a chart like you requested, I can do a general overview of the methods commonly used in RC modelling for airframe fabrication.

I must begin with this: Almost all of these are applicable to an aircraft of about any size. It's even hard to tell which is better, they're all just different. So, without further ado, the list:


Extruded polymer foam. This is what most commercially manufactured models are made of. The manufacturing process involves CNC-machined molds, special extruding machinery, and a lot of money spent upfront. However, the models can be of any shape imaginable, are quite durable, light (although not the lightest) have excellent aerodynamics, and the unit cost is cheap once you get going. The load-bearing parts are usually reinforced/stiffened with carbon fiber inserts, although wooden reinforcements are not uncommon. There are several types of foam that can be used, each with different characteristics.
Hotwired polymer foam. This is the DIY method of making foam planes, although some commercially-available planes use it as well. It involves a resistive wire which is heated by a current and is used to cut a block of foam into the desired shape using a bow or other device that keeps the wire under tension. As with extruded foam planes, load-bearing sections are usually reinforced with carbon fiber for stiffness. The same types of foam can be used as with extrusion. The available shapes are limited by what can be achieved with straight cuts, although complex shapes can be created by gluing simpler sections together. See this video for an overview of the process. Sometimes (most of the time?) only the wing airfoil is wire-cut, while the rest of the airplane is fabricated using other methods. Planes made using this method are often covered with heatshrink film to add stiffness and durability.
Folded flat materials. Airplanes can be made from a variety of sheeted materials by cutting, creasing and folding them into shapes which are then glued together. The materials include (but are not limited to) foamboard (foam between two layers of paper/thin cardboard), depron (flat sheets of foam), corrugated cardboard or even paper. The very simplest models can even be made without folding, just by cutting the required outline out of a flat sheet, while the advanced builds feature smooth curved surfaces. While usually not especially sleek-looking, airplanes made using this method fly surprisingly well and are very durable! Most of this comes from the fact that they are also extremely light for their size, though. In any case, a foamboard (or cardboard, or depron) plane is very easy to build or fix and requires minimal tools (knife, ruler, glue) to do so. This type of construction is extremely popular in the RC community due to the simplicity and cheap price. The most prominent proponent of folded models is Flite Test, who publish free plans for all of their models. There are also countless plans for folded planes on various RC forums.
Wood and film. This is the ""oldschool"" method. It is very similar to the methods used for construction of early full-scale aircraft, and involves building a wooden ""skeleton"" for the plane out of precisely-cut thin pieces of wood (usually balsa) and covering it with a special heat-shrink film to form the surface of the airfoil. This method takes a lot of time and work, and involves cutting and gluing together hundreds of wooden parts. The method creates light, strong and stiff airframes, which can nonetheless be brittle if hit the wrong way in a crash and time-consuming to fix. While less common nowadays, this construction method remains moderately popular, with a great variety of plans available online.
Glass and carbon fiber composites. While carbon tubes, strips and sheets are used extensively together with all of the construction methods discussed above to add mechanical strength and stiffness in critical points to a weaker or more flexible material, some airframes are constructed entirely out of composites. This is arguably the most high-tech and definitely the most high-performance (if done properly) construction method of the ones discussed here. It is also the most expensive one, per unit, though it doesn't come anywhere near extruded foam in terms of upfront setup costs and thus is within reach of hobbyists who want to make only a small number of copies of their design. Creating a glass or carbon fiber airframe requires making a mold of the desired shape, carefully laying up the fiber, soaking (or impregnating) it with resin and curing under pressure, usually with a vacuum pump, to make sure that the absolute minimum of that resin actually stays in the part. Then comes sanding, polishing, and assembly of the parts. Carbon fiber, when properly done, is extremely strong yet light, and is used in high-performance thermal gliders and other planes which must withstand extreme forces while being as light as possible. While strong, such planes are often hard to fix when they do get broken (at least without compromising their original strength or lightness). Glass fiber, though somewhat outdated, is also still a popular choice for larger planes, as it is significantly less expensive and easier to fix. Sometimes DIY molded glass fiber reinforcements can be found on planes constructed from other materials, and usually made by laying the fiber directly on top of the fuselage, eliminating the need for a mold.

",What are the typical methods of constructing a large airframe?,"When building a 5 feet wingspan UAV, what building techniques:


used on smaller aircraft can't scale to aircraft of this size? 
are best used on aircraft of this size?


Ideally, I want a simple graphic that tells me approximately what techniques are best suited to my requirements. Heres an MS paint mockup:


",https://drones.stackexchange.com/questions/494/what-are-the-typical-methods-of-constructing-a-large-airframe
"No matter how quickly you slow down the propellers after an impact with the ground, much of the damage actually comes from the impact directly into the ground and the force from the mass of the quad, so the speed of the props shouldn’t make too much of a difference.

If you mean the slowing down the props after it’s on the ground would save them, it may prevent further damage to the props, however the current draw if the props get caught in something could easily fry an ESC so it is likely more economical to sacrifice the props.

I generally go by the rule that if I crash, disarm as fast as possible. This stops me from burning ESCs as I’m usually disarmed before I hit the ground, though this comes with the negative that i can’t recover after a crash because I’ve disarmed.
",Does active braking help protect propellers from damage?,"As far as I know with active braking option enabled in BLHeli32 the speed controller will counteract the free spinning of the rotor according to throttle value hence making it slow down quicker when needed. Could this help protect propellers upon crash?
",https://drones.stackexchange.com/questions/958/does-active-braking-help-protect-propellers-from-damage
