Answer,Title,Question,Source
"What frame are you running?  Which propellers?  What craft AUW?

I have very similar setups built as racers, that perform brilliantly on both BF3.5.7 and BF4.1.1.  Even super-notchy 1408 motors on aggressive 3052F props can fly quite cleanly.

In terms of tunes and filters, both are nearly stock tunes and fly well, at most some filter adjustments to compensate for the higher RPM that naturally comes with 3"" craft.
",Tuning with notchy motors on Betaflight,"I'm having trouble tuning a custom 3-inch build on Betaflight.  I can't get general vibrations to go away.  I'm using RC in Power 1506 4100KV motors on 4S.  These are very notchy motors.  I've been told notchy motors are difficult to tune.  Are there any pointers out there for such a build with notchy motors?  

I've tried several versions of Betaflight 3.5.7 through 4.1.  I've turned down the filtering and the motors stay cool.  I've tweaked the PIDs a lot and it hasn't helped much.  I've even changed to a completely different Frame to get rid of any possible resonance.  I've tried soft mounting the FC, and hard mount.  TIA
",https://drones.stackexchange.com/questions/6/tuning-with-notchy-motors-on-betaflight
"This depends on your version of QX7. 

If it is ACCESS, then, as far as I know, there is currently no way to enable D8.

If it is ACCST FCC, it should already have D8 enabled by default, so it is unlikely to be this model.

If it is ACCST LBT, then when updating the radio, when selecting the features, you can enable D8 mode by selecting the appropriate checkboxes as shown in this video by Whirly Bloke: Video
",What do I need to do to get OpenTx 2.3.X to include D8 on a Taranis QX7 model?,"I'm trying to do away with swapping my multiprotocol module and CRSF Micro TX unit, and have some D8 receivers that can arguably do the trick, but I haven't had any success with this after flashing up to OpenTX 2.3 (the first nightly than enabled CRSFShot).

To clarify - this is an ACCST (non-ACCESS) QX7, running FCC Firmware on FCC flavored receivers.
",https://drones.stackexchange.com/questions/7/what-do-i-need-to-do-to-get-opentx-2-3-x-to-include-d8-on-a-taranis-qx7-model
"I've actually posed this question to an FAA Safety Team employee. These guys are top notch and know their specific field of speciality, however there is an important nuance which needs to be understood work respect to his answer.

Also, I posited the question from a slightly different perspective, however I would be highly confident that this answer would apply to your question. I emailed and asked an FAA Safety Team employee (as opposed to one of the hard to differentiate FAA Safety Team Volunteers) that if the FAA chooses to levy enforcement action(s) upon an FAA Private, Commercial, or ATP certified pilot as a result of this pilot committing a violation of a defined FAA regulation while the pilot was operating under 14CFR  Part 91, could the enforcement action be extended to other FAA issued certificates held by the pilot such as a 14CFR Part 145 Airframe &amp; Powerplant (A&amp;P) Aircraft Mechanic Certificate or a 14CFR Part 107 Remote Pilot Certificate.

Having held some form of FAA certification for over well over 3 decades, was certain I know what the answer would be, because I had heard it time and time again. And the FAA Safety Team employee responded with exactly what I thought, absolutely. But like I stated before, this ""absolutely"" carries with it a number of very important caveats.

First, while I appreciated the response, the response is consistent with all previous answers received when the question has been answered, the truth is that individual's answer to me is just barely better than conjecture. How could that be, he's a no kidding, Federal Paycheck receiving FAA Civil Servant employee, how in the hell could I suggest that his answer was anything but The FAA's version of divine intervention?

Because his job title sounds like the right guy, but he's not the got who would be making the decision, it had likely ever made that type of decision. The FAA Safety Team managers are primarily tasked with spreading the good word, about safety. They coordinate all the Safety Seminars, they can be asked to provide recurrent training to those who have been violated, but that's them doing a favor for a colleague, the colleague who actually wields the stick of enforcement. 

Those individuals are called FAA Safety Inspectors. They are the highest authority, above all the Designated Inspectors, when it comes to taking a practical flight exam. If you're a drone pilot and you're unsure if that tell, here's an opinion most won't like to hear. For every single pilot certification, applicants are required to show a 70+ on a proctored 60 - 100 question written exam (should sound familiar). But then, they are required to sit across from either a Designated Examiner or FAA Safety Inspector at a table and answer up to 3 hours worth of direct verbal worsening (called the oral exam, but that's a bit salacious to use), and then followed by what's called the Practical Exam. Based on what specific pilot certification, rating, or type certificate being sought, the practical exam Soraya takes place in the air flying an aircraft the applicant is familiar with and usually lasts over an hour performing a series of requisite manuevers which must be demonstrated within a defined set of standards.

These FAA Safety Inspectors are a group of FAA employees who are in no way affiliated with the FAA Safety Team managers, falling under a completely separate division, or what the FAA colloquially calls a separate ""Line of Business"", or LOB. 

I've been told my entire career that even my A&amp;P could legally, and in some cases would be suspended for serious enough violations being enforced upon a completely unrelated certificate. 

However, the second caveat is FARRR now important to fully understand when you are pondering such things. The FAA always has been, always will be, and will do everything in it's power to try and indoctrinate the new sUAS crowd, run as a self regulating, honor based system of checks and balances, who will do nearly everything in their power to avoid resorting to issuing violations of certificated pilots. This may seem hard to believe, but trust me, I've been here a while. 

In fact, in my opinion, it takes a pretty special kind of violation of regulations to result in forcing their hand, and even then they will put an emphasis on retraining in lieu of suspensions or revocations of a certificate. There are a few sure ways that they have absolutely no choice, at least from where I stand.

1st, Any violation of the DC-SFRA or Presidential TFR, even popup, they literally have no choice but to suspend your certificate, but also recognize that they will also be advocating on your behalf to the US Secret Service who can get a little trigger happy with the criminal charges.

2nd, Any obvious and willful violations of Class D, Class C, Class B, and/ or Class A airspace, without ATC clearance, and without offering any reasonable justification. This can also happen with repeated, obviously not getting it airspace violations.

3rd, Your violation(s) caused a severe breakdown in the flight safety of your aircraft and any others in the vicinity. If your actions result in the injury of loss of life of other people, your certificates are going to be the last of your problems. I see this being the case the first time a drone operator is foolish enough to get their platform sucked into an engine intake. 22,000 RPM turbine vanes don't have a great record of resiliency in such events, something similar killed 3 people on a Southwest Airlines B-737 a year or so ago.

3rd, If you treat the FAA Safety Investigaters with a heavy dose of wanton disrespect because you're angry they are violating your, they will drop a bookshelf on you and just watch as you struggle to find your footing, and good on them. This bookshelf is of course figuratively speaking and meant to represent worse than getting the book thrown at you. 

Here's the deal, if you're called by an Inspector to discuss some violation you may or may not have committed with a drone or manned aircraft, don't snap into the defensive posture and start to deny deny deny. These folks are absolutely here to figure out what happened, ensure you're aware of the regulations, ensure you're clear on what part of your operation was being investigated as the violation, and how to ensure it won't likely issue again on your watch. They have no desire to suspend or revoke anyone's certificates, because they are fully aware that as is often the case with named pilots, this is often the individual's means of making a living. 

So, the answer is yes, any enforcement actions resulting from any in-flight regulatory violation of one certificate can have detrimental effects on all other certificates.  it could, but the caveat is unless you're really obtuse about or have no intentions of following anyone's roles or regulations

The interesting thing about Party 107 Certificates are the numbers. This actually frustrates me for a number of reasons. Before the Party 107, I have always held at any given time, three separate FAA Pilot Certifications. My Commercial, my Flight Instructor, and my A&amp;P Mechanic certification. Every single one of those really gave no relation to the others, the Instructor Cert being related to Commercial Pilot Cert, I'll concede, but nothing else. Despite these differences, every one of my FAA certificates were adorned with the same number. 

Every single one, except now for my Party 107 Remote Operator Certificate. The rumor was back in the day that this was done many years ago to ensure investigators were aware of all certificates. It's BS because my 107 is listed right next to my Commercial Certification record at the FAA. 

However I'm quite frustrated that the FAA didn't harmonize the pilot databases, as this former alienates the drone members of the industry, and that's asinine. 

I think that answered the question asked. 
",Is it possible to get a FAA Part 107 drone license if one has had a pilot license revoked or suspended?,"A Part 107 license (which requires a knowledge test and background check) is required in order to use a drone commercially in the US. If one has lost an FAA aircraft pilot license (that is, a license to fly human-piloted aircraft), does that make one ineligible to hold a Part 107 license or is drone licensure based only on whether one is capable of operating a drone?

If only certain types of license loss (e.g. medical disqualification versus revocation for violating regulations) count, under what conditions would a prior loss result in ineligibility to hold a drone license?
",https://drones.stackexchange.com/questions/10/is-it-possible-to-get-a-faa-part-107-drone-license-if-one-has-had-a-pilot-licens
"The crossfire OSD has a “my VTX” setting on the transmitter settings pane: I had “XF TX LITE > MY VTX > ACTIVE” set to “Yes” and the channels it would flip back to were set there. It seems the “MY VTX” section overrides whatever the unify is trying to do. Once I set that to “No” the changes I made stuck.
","Crossfire, Unify VTX settings are being overwritten","I have a crossfire nano hooked up properly to a unify pro32 HV.  Everything works as expected and perfectly except when I use the Crossfire Lite OSD to change the VTX settings.  

When I change the VTX settings, such as channel, I can see the signal switching in the goggles (goes from perfect image to static) and I can even change the channel in the goggles to the new channel being blasted from the VTX and I can see the video.  But about 5-10 seconds later, the VTX settings automatically change back to the initial settings.  In the example above, the channel reverts back to the initial channel and I can change my goggles back to that channel to see it again.  

I've tried hooking up to the TBS agent to switch the channels and that works as well, but again, it reverts back in 5-10 seconds.  

Here's a video to show what's going on: https://photos.app.goo.gl/p6Dt7A11EWjBS3Vz9
",https://drones.stackexchange.com/questions/14/crossfire-unify-vtx-settings-are-being-overwritten
"Unmanned aircraft weighing less than 55 pounds and more than 0.55 pounds (250 grams) on takeoff, including everything that is on board or otherwise attached to the aircraft and operated outdoors in the national airspace system must register.

Federal Drone Registration: FAQ (Updated February 02, 2020)
",What counts towards the official weight of a drone?,"In the United States, a drone that weighs 55 pounds or more needs to be registered using a different process than lighter drones.  What counts towards that weight -- is it dry weight, fueled weight, maximum takeoff weight, or something else entirely?
",https://drones.stackexchange.com/questions/21/what-counts-towards-the-official-weight-of-a-drone
"You may need new batteries.

When a LiPo battery fully discharges, thin whiskers of lithium metal form between the plates of the battery.  Attempting to recharge the battery will cause these whiskers to overheat, which may cause the battery to catch fire or explode.

Commercial batteries from reputable manufacturers have self-monitoring circuitry that will permanently disable the battery if the charge level drops too low.  If the batteries are of this sort, it's safe to test them by recharging -- if the battery has been damaged by over-discharge, it simply won't take a charge.

Cheap third-party batteries and homemade battery packs don't have this protection.  A battery that's only been sitting for a year may still be good -- I'd try recharging it in the middle of a concrete driveway or some other well-ventilated, fireproof location.  With a battery that's been sitting for three years, I wouldn't risk it.
",How to restore LiPo-powered aircraft that have not been flown for years?,"I have a bunch of relatively inexpensive battery-powered radio-controlled aircraft that I haven't flown in over a year.  I haven't flown some of them in over 3 years.

The aircraft are airplanes, helicopters, and drones.

I believe they are all powered by LiPo batteries that are designed to be recharged, not replaced.

From what I've learned about LiPo batteries, they tend to go bad if not used for a long duration.

What general steps do I take to resurrect all these aircraft so I can fly them again?
",https://drones.stackexchange.com/questions/42/how-to-restore-lipo-powered-aircraft-that-have-not-been-flown-for-years
"I have recently written a dissertation on non-military drones and the first mention that I could find for what we would consider modern drones used in a context other than direct military action was when, in 1994, they were used as overhead surveillance for NATO envoys in Bosnia.

In terms of any UAV, not necessarily guided aircraft, the incendiary balloons are the earliest example I can think of, however, carrier pigeons were used as early as 1150 according to Wikipedia, so this may qualify.
","The earliest recorded use of a UAV for military use was in July 1849, but if we include non-military UAVs, was there anything earlier?","The history of drones Wikipedia article starts with the Austrian incendiary balloons of July 1849 as the first recorded use of UAVs for the military. 

Was this the earliest record of any UAV, whether for military use or not?
",https://drones.stackexchange.com/questions/56/the-earliest-recorded-use-of-a-uav-for-military-use-was-in-july-1849-but-if-we
"You should store the battery fully charged as little as possible; a few days is probably fine, but when it gets closer to a week or more you might start to see it's health degrading. That said, there is no hard limit where it will stop working, so my advice is to charge it when you are going to use it, and then charge / discharge it to 3.8 V / cell when you are done.


  A battery sitting at room temperature fully charged will lose about 20% of its capacity in a year. A battery sitting at 60 degrees Celsius will lose 40% of its capacity in just 3 months.


https://brushlesswhoop.com/storing-fully-charged-lipo-batteries/
",What is a safe amount of time a LiPo pack can be kept fully charged before it is discharged to storage capacity?,"Is there any research that shows the actual decrease in capacity/performance/longevity of high discharge current LiPo batteries, like those used in quadcopters, depending on the total time they spent being fully charged? Maybe there are some chemical processes that start to occur after some time of being charged which should be avoided and the time until they start being harmful can be measured or calculated...

What rule of thumb (that can be scientifically backed, or would at least be an educated guess) can we assume to keep the batteries in good shape without being too extreme?
",https://drones.stackexchange.com/questions/61/what-is-a-safe-amount-of-time-a-lipo-pack-can-be-kept-fully-charged-before-it-is
"Micro drones are between 250 grams and 2 kilograms:
Micro drones
These need registering, so therefore a foreigner will not be able to fly them. What you stated is for commercial purposes only. If you do want to fly commercially you will have to do some research before you travel, contacting an Indian entity and asking them to register it for you. This can be quite a hassle so I wouldn't do this unless it was really important.
",How can foreigners fly non-nano drones in India?,"According to some pages I found online, foreigners who want to fly non-Nano drones (drones over 250 grams) in India must lease their drone to an Indian entity who has authorizations from the Indian aviation regulator (DGCA).

How does this process work? Has anyone had experience with it? Can it be used only for commercial purposes, or also for recreational purposes?
",https://drones.stackexchange.com/questions/66/how-can-foreigners-fly-non-nano-drones-in-india
"The trouble with making a nano drone is that for it to be what is commonly considered a ‘drone’, it needs to be able to be controlled via radio waves and/or be programmed to complete specific tasks.

The trouble this introduces is that to receive radio waves effectively, the receiver antenna needs to be around one-half wavelength (AFAIK), so nano-scale drones are not practical for current technology.

Two very well-known ‘micro’ drones are the Cheerson CX-10 and the Hubsan Q4 H111, both of which are approximately 25mm by 25mm.

Of course, this is only considering consumer drones. Scientific laboratories, universities and the military likely have much smaller hardware.
",What is the smallest drone ever made?,"There are nanocars and nanomachines in general. 

I would be very impressed if a nano drone or nano-UAV existed, however, I would not be surprised if there has been something built on the microscopic scale.

What is the world record for the smallest drone ever made?
",https://drones.stackexchange.com/questions/73/what-is-the-smallest-drone-ever-made
"The most appropriate answer I could find comes from this study which states that a charged LiPo should be returned to storage charge if you do t plan to use it within the next 12 hours, and leaving it longer will cause a buildup of damage. The study is very interesting, though it may not explicitly answer your question I recommend giving it a read.
",How long can a LiPo pack be kept fully discharged before storage charging?,"There is a reason LiPo packs are recommended to be stored at a storage charge. It is commonly known that storing a battery fully charged reduces its capacity and performance. What about storing batteries discharged after flights for extended periods of time?

Has any research been done on this topic?

Suppose I flew today and the next time I'll be flying in 7 days.
Which is better:


leave the packs discharged, and charge after 7 days,
storage-charge immediately, fully charge after 7 days,
fully charge immediately, leave charged for 7 days?


What about 3 days or 2 weeks instead?
",https://drones.stackexchange.com/questions/74/how-long-can-a-lipo-pack-be-kept-fully-discharged-before-storage-charging
"Assuming you can only use up to four motors (because if you used six, eight, or even more you could just lift something with brute force) the most thrust dense configuration would probably be a ducted fan quadcopter. 

The reason for that is ducted fans essentially stop a lot of air from being propelled sideways and more air goes down. Ducted fans can provide more lift and are more efficient than open-prop designs. 

A helicopter would only have one motor and would need to be much larger to provide the same thrust as a quadcopter. Those other configurations mentioned would also not have nearly the thrust of a quadcopter of a similar size. 

So, the best option would be a ducted-fan quadcopter (or hexacopter/octocopter if you can use lots of motors) with oversized motors. A good propeller would be a large prop as it gives more thrust at the expense of maneuverability and acceleration. Wider motors give you more torque but taller motors give you more RPMs so that depends on the prop. (A heavy aggressive prop should go with a wide motor and a lighter prop should be paired with a taller motor)

If you don't really care about longevity, get a powerful ESC, high cell-count battery (probably 6s), and get a motor that is higher than normal KV for maximum thrust and power at the expense of the motor's longevity. But be careful to not go too crazy with the high KV as it could potentially burn out an ESC or destroy the motor.

Also, as durability is not really that important for the purpose of this specific build, make it as light as physically possible (but still rigid, you don't want vibrations or flex) so that it can lift as much weight as possible. 

Hopefully, this helps, as I'm not really sure what all of the requirements of this drone are. 
",What is the most thrust dense copter configuration?,"I need to make a compact drone that does not need to be fast, nor very power efficient*. I wanted to know what is the most mass I can lift with the smallest footprint**. 

To make this question more answerable: which is more compact for the same amount of payload (say 50g), a helicopter, a quadcopter, a quadcopter with duct-fans, or another strange configuration like: the dronut, the rollocopter or the ball drone?

Are there any resources out there that have made such comparisons?

* Not exactly true.

** Footprint - in case it was not completely obvious what I meant - is the transversal area of the drone. Or consider it a volume and assign it the volume of the smallest sphere that can contain the whole drone while flying.
",https://drones.stackexchange.com/questions/106/what-is-the-most-thrust-dense-copter-configuration
"Some good info at Flite Test with video content as well. If you can create a ""mix"" in opentx (which takes some getting used to) you can apply the same methodology to setting this up.  There are lots of video tutorials etc.. for this.  Once you can do mixing on your Taranis, the content below may help.

In the example, they are using a Graupner radio (the same to dislike opentx??), but the idea should be the same.  What you are doing is attaching the thrust of the two motors to the rudder channel input so it will change each motor as you yank the rudder.    

Flite Test demo of differential thrust
",How can I set up differential thrust for a model airplane?,"I have a Taranis Qx7 Radio and built an FT Mighty-Mini Scout which flew great, but now I want to put an extra motor and fly it using differential thrust. My understanding is that it needs to be set up on the Mixers Page on the radio, and also I'm not sure how to wire it up.
",https://drones.stackexchange.com/questions/139/how-can-i-set-up-differential-thrust-for-a-model-airplane
"Normally the best way is to start by forking the betaflight or configurator repository and work on some issues in their respective GitHub issue trackers and submit pull requests. Given that you are an Android developer, I assume you are familiar with UI development so I'm sure they would appreciate some feedback on the configurator UX.
",How can I become a contributor developer for the Betaflight project?,"I am a mobile developer for the Android platform and recently found I highly growing passion for self-built drones.

I have also noticed the community around this hobby is very collaborative and it would be extremely helpful to know a viable way of becoming a contributor to the Betaflight project to start doing my part for the community.
",https://drones.stackexchange.com/questions/140/how-can-i-become-a-contributor-developer-for-the-betaflight-project
"This blog describes what the VTX setting is:

An interesting new feature you will start to see more of is VTX telemetry. This basically allows you to change settings for your video transmitter via the OSD menu (or your R/C controller if you want to get fancy). These sorts of shortcuts are designed to cut down the setup time allowing you to focus on the fun stuff!
Does it affect my VTX if I'm using smart audio vs VTX to the transmitter?

The TBS Unify Pro supports smart audio. It doesn't really make a difference but Smart Audio is more modern and SmartAudio protocol coffers commands such as: GET​ ​SETTINGS, SET​ ​POWER, SET​ ​CHANNEL, SET​ ​FREQUENCY and SET​ ​OPERATION​ ​MODE
",TBS My VTX setting,"There is a setting on the full-size CrossFire unit.  What does ""My VTX"" do?  What really happens when it's on vs off.  

Does it affect my VTX if I'm using smart audio vs VTX to the transmitter?
",https://drones.stackexchange.com/questions/143/tbs-my-vtx-setting
