Answer,Title,Question,Source
"You need to be specific about what IMU hardware you are using, like a general purpose IC like MPU6050 (gyro + accelerometer), or flight controllers like  Pixhawk, pixRacer, etc ..
In Order for you to achieve a fine tuned, linear input-output response, you need to take care of few things firsts and accept some constraints :

you cannot fully get rid of vibrations, but hopefully you can reduce it to an extent by using  anti-vibration absorber like this



You cannot achieve a linear relationship between input and output signals. This is mainly due to limitations of The flight hardware you are using
In the end, the goal is get proper output signals rather than reduce vibrations. this can be achieved  by


1)Research more about your IMU hardware, like manufacturers Datasheet, or asking with the community

The reason why you are getting a change in pitch angle is due to its internal offset of various parameters associated with its IC manufacturing.

Coming to UAVs, you need to implement your own PID algorithms by using digital filters like Kalman Filter, or you can choose Open Source flight firmwares for your IMU hardware.

After implementing and testing your filter, you need to fine tune it by hooking the output to a DSO and modifying the filter coefficients to suit your needs. A lot of trial and error goes into finding the tuning parameters like Kp, Ki, and Kd.


",Eliminate effect of Vibrations on IMU,"I am testing pitch orientation correction of Quadcopter and ended up in a issue.
I have a test setup with one degree of freedom to test orientation correction. I have fixed the drone to the setup and basically trying to test pitch correction by feeding a desired pitch angle and current pitch angle from IMU. The AHRS code uses Mahony filter to fuse the sensor data from Accelerometer, Gyroscope and Magnetometer. When I start my testing and spin the motors, can see the current pitch angle varying (or Oscillating). When I test without spinning the motors, the pitch angle is much precise. I observed that when the motors spin, a lot of vibration is generated and i doubt this is affecting the sensor to result in inaccurate output.
My question is

How can the vibration effect be nullified on the IMU sensor? By using some hardware component?
If it can be handled using Software, please let me know.

Thanks
",https://drones.stackexchange.com/questions/1754/eliminate-effect-of-vibrations-on-imu
"Lower kV motors will spin more slowly but with more torque. Spinning more slowly (with the same prop) will give you less thrust and less power (and thus lower current) at full throttle.
However, a well setup quad doesn't spend much time at full power, especially when you're considering your total flight time. The amount of thrust required to fly is still the same because the weight and drag haven't changed, so if the props are the same they will still need to spin at the same speed. To reach that speed, you'll need more throttle. Top speed will be reduced and if that leaves you flying more slowly than before, your flight times will increase - but you could probably get the same effect just by flying more slowly.
There may be some difference due to the relative efficiencies of the two motors, but it will be small. I don't know which would be better and you probably won't notice it.
However, that assumes you keep the same props. A lower kV motor really needs larger props, so it can generate the same thrust at lower RPM. Larger props should be more efficient because they act on more air and don't have to move it as fast. That should give you longer flight times and more thrust at low speed, with a possible reduction in top speed.
Of course, all that is irrelevant if your frame doesn't have space for larger props.
","If AUW is 90 grams, will 4500Kv motors be better than 7500Kv?","I have a build that is 90 grams and runs great with 7600Kv motors. My question is, if everything stays the same and I put on 1204 4500Kv motors on it, would I get more flight time? More power or torque? Or both? Thanks
",https://drones.stackexchange.com/questions/1759/if-auw-is-90-grams-will-4500kv-motors-be-better-than-7500kv
"You might check out this video on using a Pixhawk and a rPi with Python.  The video just walks you through the serial connection and some Python code for basic control.  The Pixhawk is doing all the real time control (Linux isn't good for that part) and the rPi is talking to it over a serial port.
You might also look at the MicroHawk reference in:  Do drones with inflight API access for control inputs exist? (although the link seems to be broken at the moment).
","Drone with SDR for HF antenna field strength measurements, I need a Raspberry Pi based drone kit that I can just buy","I have very little time until I get to the USA to buy the material to put together a drone which I want to use to measure antenna gain patterns for HF radio. Example, a 20m band half-wavelength dipole antenna is 10 m wide and should be mounted 10 m above ground, probably it will have to be less. Additional parasitic elements of about 10 m wide spans are added around the main driven element to achieve directional gain.
The issue is measuring this gain for which one needs to get two wave lengths away and up all around the antenna assembly, which is easily 100 m all around. And for 40m, 80m, 160m band antennas it would scale accordingly.
The measurement device we would need to lift up is an SDR (software defined radio) device, which can be as small as a USB dongle, along with some small receiving antenna. The drone would fly around the transmitting antenna and would measure the antenna's gain pattern on a set of chosen frequencies and transmit power while we would be intermittently transmitting our call sign in Morse code like a beacon. Given the fact that it's an experimental antenna assembly, the drone should re-take the same flight path several times as we adjust the setup.
Since an SDR dongle needs to be plugged into a USB port of a computer running some Linux, the Raspberry PI comes to mind. And to avoid having to carry that as extra payload, I want to have a drone which has a PI as its main control and communication module.
I have seen several PI drone projects, dating as far back as 2016, but even after all that time I have not seen an affordable kit. It should be around $200, as even in 2016 a ZDnet article talked about a DIY PI drone in that budget. Since I have very little time to get the parts together while on a short visit to the USA before returning to South America where everything is twice as expensive, I would like to find something that I can just buy. Do you know of a kit or a state of the art shopping list that is based on a generic drone kit?
[Hey Stack-Exchange police: this is not just a shopping question, it is a state of the art question.]
What is the state of the art in Raspberry Pi drones now? Much has happened since 2016.
How can I tell from looking at drone kits on Amazon for example, how much payload they are able to carry? This is not reported in the specs that I can see.
I would like to avoid the RC gear and just use WiFi to control the drone and receive the telemetry data.
",https://drones.stackexchange.com/questions/1775/drone-with-sdr-for-hf-antenna-field-strength-measurements-i-need-a-raspberry-pi
"The beep from the transmitter indicates that it has linked successfully with the receiver on the drone, so at least part of the board is working. However without detailed knowledge of the design and a range of test tools it will be very hard to trace the fault accurately. Even if you did, you need specialist soldering tools to replace tiny surface mounted components, and the fault may be in a chip with proprietary firmware (i.e. not available for sale).
Really the only type of repair you could do is to replace the entire board, but I'm not sure they're available and given the price of these things I think you'd be best to buy a whole new drone and keep the frame, motors and props as spares because they are the parts that usually break.

What could have gone wrong

If it was wet when the battery was connected, it's likely that the water formed a galvanic cell between the copper traces of the circuit board and some of the other metals in the solder and component legs and cases. Galvanic corrosion is much faster than ordinary corrosion, and has probably caused an open circuit somewhere.
The other option is a short circuit that generated enough heat to melt some solder and break a connection.
If you dried it thoroughly before reconnecting the battery, then you did everything you could have, and that's normally enough - but small drones are made with the cheapest components and quality control is minimal, and sometimes they do just die unexpectedly.
",How to debug a non-working Eachine E010?,"I have two Eachine E010 drones. One drone (green color) stayed outside for a night with rain. I inspected the circuit board and it shows no damage: no cut cables that I could solder, nothing corroded. Both the transmitter and the drone turn on and show light but the transmitter does not control the drone. I turn both on within 2 seconds of each other, push the left lever up and down and the transmitter beeps, but the controls have no effect. (Note: when the drone is turned off, the transmitter has the same behavior: beep when I push up, flashing light, beep when I push down, steady light, so the beeps do not indicate binding with the drone.)
The other drone (red color) works fine. The green transmitter can control the red drone, but neither transmitter can control the green drone. I could not find a way to reset both to factory settings.
What could have gone wrong, and how to fix it?
Update: Here are pictures of the drone. The drone was powered while in the rain: a child left it on a house roof upside down and I realized and took it the next day after a night of rain.



",https://drones.stackexchange.com/questions/1777/how-to-debug-a-non-working-eachine-e010
"I don't know about a simulator. However, often in motor's datasheets it will say power consumption and expected thrust under different conditions. Keep in mind that things aren't 100% efficient and you need to multiply the number for one motor by 4, for 4 motors.
For example, here is a motor from sunnysky, and you can follow the chart for prop size, thrust, power, etc. 
",Drone/Quadcopter sim that allows custom building/editing of (large) quads?,"For some reason, there seems to be a huge gap when it comes to medium-sized video platform drones, such as one I'm planning to build. I don't have any experience with acro flying, so while pretty much any popular drone sim would help tremendously, I'd like to get a feel for how my much larger drone will fly (in acro) without risking a crash.
I'm looking for a simulator that will specifically let me replicate and practice on my real drone as closely as possible. It has 15&quot; props, 600kv 4108 motors, 680mm (ZD680) frame, and will use a 4s. I've yet to see a single drone like this in a simulator. I guess what I'm looking is something where you could actually plan out a build accurately in software without purchasing a single part.
",https://drones.stackexchange.com/questions/1778/drone-quadcopter-sim-that-allows-custom-building-editing-of-large-quads
"Try lowering your $D$ coefficients by $10$ in each direction. If that doesn’t help, slowly try increasing your $I$ coefficients.
[Make sure you first implement (and TEST!) a kill switch any time you are modifying PID terms (particularly $I$ terms) as you can create an unrecoverable flyaway situation!]
",Drone wobble/bounce while flying,"I recently gave my newly built (with old equipment) its first flight. As you can see throughout the video there is a wobble as I fly.
https://youtu.be/foo7Tw1gYNY
I am running an SP Neo F3 FC with Cleanflight on a QAV-X Charpu frame.
Just wondering if any of you know what are some of the things I should look for that might cause this.
Edit: I re-calibrated the accelerometer which was a bit out, but still experienced the wobble.
",https://drones.stackexchange.com/questions/1800/drone-wobble-bounce-while-flying
"Okay, one more suggestion, This is only $127 (97 with Amazon coupon aplied) It is the Uranhub foldable GPS drone. This is all the information I could get on it:
Specification:
Video Resolution: 2K
Control Distance: 220M / 720FT
Maximum Flight Relative Height: 120M / 394FT
Modular Battery：2 Li-Po Battery
Flight Time: About 15 Mins per battery
Drone Battery: 7.4V 1000mAh(rechargable)
Charge Time: About 2.5 H
Expand Size: 12.912.92.2 In
Folding Size: 6.95.52.2 In
The only problem is that you have to time-lapse the footage afterward,
but there are plenty of apps and sites that do that, here is a website that will help:
Invideo (time-lapse website)
Drone purchase link
",I need a low cost drone for point cloud modeling. What are the alternatives?,"I am searching for a drone to work with point cloud modeling. The drone must have features such as orbital flying (flying around the subject with the camera always aimed to the center) while shooting photos (not video) at automatic time-lapse (2s).
I can't buy a DJI, and I already know that FIMI X8 SE can be used for modeling. However, there are some serious quality issues with the latter.
What are some other, low-cost alternatives with the features I mentioned?
",https://drones.stackexchange.com/questions/1801/i-need-a-low-cost-drone-for-point-cloud-modeling-what-are-the-alternatives
"Some simple things to look for before we go deeper:

Did you check that all four props are mounted correctly? (CW on top left + bottom right, CCW on top right + bottom left)
With your props off(!), your drone connected to the Betaflight Configurator, and your control inputs neutral, are all three control axes all centered (at $1500$) in the Receiver pane?

",Drone tipping over when attempting to fly (possible accelerometer problem?),"This is my first time building a drone, so sorry if this is a stupid question or I use the wrong words. When I attempt to fly my drone, it immediately tips over (link to video here: https://youtu.be/og8w9KjhzBI). I know its not a problem with the motors themselves because when i turn the motors on using Betaflight Configurator, they all spin at the same speeds. I made sure my accelerometer was properly calibrated through Betaflight, and have searched the web for hours attempting to find an answer to no avail. Any help would be much appreciated.
",https://drones.stackexchange.com/questions/1803/drone-tipping-over-when-attempting-to-fly-possible-accelerometer-problem
"Ordinary FPV cameras output an analogue PAL or NTSC TV signal, which you should be able to plug straight into a TV or goggles that are intended for watching TV.
Some FPV goggles only have a receiver and no input socket, but the good ones generally allow you to change the receiver, and thus have a socket for the AV signal. (Also some of the very cheap ones are just a box for a screen from an automotive reversing camera system, and expect you to provide your own receiver)
So, skipping the radio link should be easy enough, which is good because you do get some radio 'noise', especially if you're indoors where the signal can reflect from metal objects, or where there's interference from WiFi and other electronics.
Good quality FPV cameras are generally optimised for a wide dynamic range (so you can still see details on the ground when the sun is in the picture) and low light (it's common to finish an evening flight and be surprised by how dark it really is) and low latency (for racing) but the resolution is usually fairly limited because the radio bandwidth is limited.
It gets harder if you want better resolution. The only real option from the FPV world is the DJI digital FPV system, but it's quite expensive and I don't think you can use it without the radio, which is integrated into the goggles. The goggles may have an HDMI socket, but the camera doesn't.
Then again, there must be HDMI cameras outside of the FPV world. A quick google shows lots of people using DSLRs, and lots of action-cams (like GoPros) have HDMI ports - although I'm not sure if they support real-time video, or just replay. Also, any form of digital processing introduces some lag, and it doesn't take much to make hand-eye coordination difficult.
",2D/3D/fpv video glasses to use with external camera,"I do not have any prior experience with FPV goggles (never owned one), but now I am involved in a project where I need to connect a video or FPV glasses to an external camera through a wired connection and watch the camera view on the goggles.
It is important that it is connected to an external camera because I need to achieve that point of view. A person must be able to see his own hands through the camera if he points the camera towards the hands! This is a must.
I have been looking through the internet trying to find some potential glasses that I can test on, and I have found the following:
(Option 1), (Option 2), (Option 3), (Option 4)
Since the goggles and the video camera will always be within a close range, I am at the moment considering a wired connection. I assumed that wired should provide with better quality video compared to wireless. Is that correct? If not, there is absolutely no reason for me to go wired, and I'll go wireless.
For now, I consider wired connection, therefore the goggles must have AV or HDMI input that I could plug my camera into, which is my main concern.
Few questions I have regarding this project

Wired vs Wireless communication between the goggles and the camera? Is it true that using wireless will reduce the preview video quality?

AV or HDMI? I was planning to use an FPV camera such as this, and connect it to my goggles through an AV cable. However, I am concerned about the video quality. Will the HDMI provide better quality video? In that case, I must consider glasses that have hdmi input and must find a small camera that I would be able to conveniently mount on a stick (planning to use something like a selfie stick).


The price is not the biggest problem here. I am willing to spend extra to achieve very good quality video preview through the goggles.
I am hoping to receive some help from people who know about FPV (2D 3D video) goggles, FPV cameras and AV/HDMI. Appreciate any help
",https://drones.stackexchange.com/questions/1822/2d-3d-fpv-video-glasses-to-use-with-external-camera
"1&gt; The &quot;4 in 1 chip&quot; does handle more protocols than the CC2500. It has the CC2500, nRF24L01, A7105 and CYR all integrated in one package and allows you to bind with and use Flysky, Spektrum, HUBSAN, DSM2, DEVO, J6PRO, ESKY, HISKY, KN, V2X2 and ASSAN receivers which you won't be able to do with just the CC2500.
2&gt; Spektrum is basically a brand of high end radios. (At least they are high end for me)
",multi-protocol transmitters -- difference between stm32 4-in-1 and stm32 c2500 only ? [tx16s Vs. tx12],"Searching on the radio controllers radiomaster TX16s and TX12,

I found that video https://www.youtube.com/watch?v=ekrG5meNZOU%3F&amp;t=5m47s
that warns me that Tx16s has an internal stm32 4-in-1 protocols chip, whereas Tx12 has an stm32 c2500 &quot;only&quot;, according to this opensource project website : https://downloads.multi-module.org/

What are the cons with the c2500 chip ? Does it handle less protocols ? Does it provide less power to the 2.4GHz antenna and thus reduces the range for sending commands?
What is spectrum protocol ? A brand of drones ? I often hear about these recceivers for not being compatible with universal radio transmitters

",https://drones.stackexchange.com/questions/1824/multi-protocol-transmitters-difference-between-stm32-4-in-1-and-stm32-c2500-o
"The discovery frame uses the old DJI plastic arms and the arms are not very stiff. So you get a lot of flex in the arms. This leads to two major problems: vibrations and the quad has a relative long delay until force of one motor really starts to rotate the quad. This problem gets amplified if you are using out of balance motors or very felxible propellers. This would explain the unstable flight you are describing.
I'm afraid that this is a &quot;hardware problem&quot; and not a &quot;software problem&quot; that you can fix with some PID settings. Modern flight controller firmware is built with certain assumptions about the used frames/escs/motors. A 10 inch prop on a 810KV motor with 3S and a plastic frame isn't a target platform for betaflight or any other race/freestyle oriented FC firmware.
What are your options? Make the frame as rigid as possible and try to dampen the FC so you get rid of the vibrations (e.g. put double sided tape under it). I don't know what FC you are using but try to get some blackbox logs to see the frequency range of the vibrations and try to add more filtering to clean up the signal for the FC. After that you can start to tune the PIDs and maybe get a flyable quad. You can tune the quad without any flips and rolls because with a low power/weight ratio the quad will probably crash in the process. So just tune the quad for regular forward flight.
",How to tune a Deadcat Quadcopter with 10 inch props and asymmetrical mass distribution along the roll axis with a low power to weight ratio?,"I have a quadcopter with TBS discovery frame and 10inch props running on 810Kv motors on 3S. The quadcopter has an asymmetrical mass distribution since the heavy battery pack at the back causes the weight to be heavily skewed towards the back. The quad is really unstable and a pain to even hover properly, even in angle/horizon.
I was going through another thread on this stackexchange, and was trying with low PIDs to no avail. Turns out I need high PID gain for a craft with low power to weight ratio (around 8 : 3). My tune still seems to have some issues, since my quad was still having oscillations and it suddenly lost altitude and slammed hard into the ground when faced with a sudden gust of wind while hovering at 20m. Doing fast moves like rolls and flips with this quad doesn't really appear to be a good idea before setting up the PIDs properly since it is a bit to large and risky. Most of the tutorials I have followed seem to be stuck on gauging response to sharp turns and pitches and rolls, so I am not sure how to go about it. Increasing I or decreasing P and D makes the quad even not wanting to lift up from the ground, oscillating on the ground like a pendulum along the midline.
This drone is just a hobby project with no special use case. I will be using it just for leisure flying.
",https://drones.stackexchange.com/questions/1825/how-to-tune-a-deadcat-quadcopter-with-10-inch-props-and-asymmetrical-mass-distri
"Here's a guy hanging a 360 camera from a Mavic air 2. He had some issues getting the drone to land or automatically landing during flight but his rig might work for your needs
https://www.youtube.com/watch?v=Vo4yg8lsHQw
",Recommended drone for 360 HDR sky photography?,"Can someone please recommend a drone I could use for amateur 360 HDR sky photography in the USA? I hope recommendation requests like this are on-topic here.
Requirements:

I will be mounting a Ricoh Theta Z1 360 panorama camera weighing less than 200 grams on top of the drone.
The camera will be atop a 0.5 meter mast above the drone, so the center of mass will be high (This is so the drone itself will occupy a relatively small region of the panorama image)
The drone must be able to hold a moderately steady position for about a minute while acquiring the multiple images needed to construct a high dynamic range sky image (True HDR, not just tone mapped).
The altitude during image acquisition will be roughly 30 meters, to be above nearby trees, power lines, and buildings; so distant sky, clouds, sun, and mountains are the main focus of composition.
I'm technically skilled, so I can do some assembly and simple electronic work. But I don't want to make a PhD thesis out of this.

Optional:

The drone should be constructed of narrow struts, so the drone itself occupies as little of the panorama image as possible.
The drone should be paintable, so I can use color to help edit out the drone image in postprocessing.
I am a novice pilot; so I also want a recommendation for a cheap durable drone I can use to develop piloting skills before operating my real drone.
It would be nice to have some way to alternately mount my camera 0.5 meters below the drone, for landscape images, but while also protecting my $1000 camera during landing and emergencies. Remember that this camera takes an image in every direction at once, so surrounding the camera with a cage or landing gear is not an option.

",https://drones.stackexchange.com/questions/1829/recommended-drone-for-360-hdr-sky-photography
