Answer,Title,Question,Source
"I've gone out and asked an actual racer about this one.

There are usually some visual cues. The course is laid out in cones, the flags are asymmetrical so you know on which side you should pass, the gates you must fly twice through usually have something (bright fabric, a flag, ...) next to them on the side that you fly around before going back into the gate, etc. and the cones themselves are not just a flat string but are laid out in certain patterns; for example, when the sequence of cones terminates in an arrow this usually indicates you should go upwards (or higher, i.e. in the case of two gates stacked on top of each other), while a perpendicular line marks the entry point of the cone string.

Sometimes the track elements are colored differently (and asymmetrically) to indicate the direction. Some elements just have canonical uses based on their shape: you should pass through gates, fly besides flags, dive the dive gates... The Jacob's ladder specifically is almost always passed top to bottom in sequence (while whether you should go right or left varies track to track).

That said, there is no universally accepted, set-in-stone standard for these cues. Which ones are used depends a lot on the materials available to the race organizers, how much time they have to set up the track, the track's layout, etc. For instance, flags can either be fabric on a springy pole (in which case you fly on the convex side), or they can be inflatable and curved to hang over the ground (in which case you fly under the overhang on the concave side).

Most drone racing leagues have their own standard of how different track elements and maneuvers should be marked on the racetrack and try to stick to it. Even then some smaller local or regional events of the league may be limited by the organizers not having all the required materials. Also, one cannot mark everything on the more complicated, technical tracks, or mark it in an unambiguous manner. Sometimes some parts of the track are formed by the terrain itself, i.e. an abandoned building or natural rock formation. In that case there's no standard and the track designers must get creative to even make it clear where the gates are!

So visual cues aren't everything. A lot of races rely on communicating to pilots how the track should be flown before the race. Sometimes it's a verbal briefing, sometimes a printed schematic. Sometimes the track is published well in advance so pilots could train on their home field or in a simulator. There could even be a video walkthrough or a DVR of a practice run. Additionally, many leagues actually perform a physical walk through of the track on or before race day (much like Formula 1 car racing), so that the marshals and pilots can discuss challenges, specific items and hazards, etc.

In the end, for serious racing, how the track itself is marked does not matter. During the actual race the speed at which everything is happening does not leave you any time to think or figure out what's coming next by parsing the track. The racer just knows in advance which gate or maneuver comes after the one he's flying through, and anticipates it, most likely along with the one after that as well. Knowing the track is a very important factor in winning a race, as in order to have the fastest (which usually means shortest) trajectory, the pilot must start the necessary maneuvers for passing the next gate while he has not yet passed the previous one. 

Besides training beforehand and learning the track from the given materials, the racers are always allowed to fly some laps around the actual final track before the race in order to memorize its layout. This is critical as the actual racetrack will always slightly differ from whatever training track they might have constructed for themselves. During these training laps they also figure out the best way to tackle the elements of that particular track in the speediest way possible, and thus develop an optimal trajectory, or racing line, as it's usually called. 

So, in the end, the on-track markings are there just to aid in the initial few laps as the track is being learned by the pilot, and after that, memory takes over.
","In drone racing with multirotors, how does one navigate the course?","Whenever we watch drone racing, there is usually a course marked out in cones.

However, when there is an obstacle such as a Jacob’s Ladder, the racers know the order to go through each of the gaps. Similarly, we sometimes see racers fly through the same gate twice in a row.

How do they know to do this?

Is there a special way of marking out the course that is universal, is there a briefing prior to the race, or is there another method?
",https://drones.stackexchange.com/questions/438/in-drone-racing-with-multirotors-how-does-one-navigate-the-course
"There are three ways you should know to enter DFU mode.

The first, as mentioned before, is to push down the bootloader button and power on your board.

The second method is to be used on boards that don’t have a bootloader button (which is increasingly rare). You will need to bridge two bootloader pads on your flight controller to enter DFU mode. Check the specific diagram for your flight controller to find out exactly what pads you need to bridge.

The last method is to enter the CLI and type either ‘DFU’ or ‘BL’, which will then put the FC into DFU mode. Obviously this method won’t work if you’re entering DFU mode because you ant connect to your computer.
",How to enter DFU mode on my flight controller?,"How can I enter DFU mode on flight controllers, in particular on my CL Racing F4S flight controller?

Ref.: https://cl-racing.myshopify.com/products/clracing-f4s
",https://drones.stackexchange.com/questions/595/how-to-enter-dfu-mode-on-my-flight-controller
"As someone who loves collecting data for analysis, I do track all of my flights.  I have found that, under normal conditions, brushed motors should last for at least a few hundred flights.  You can get higher if you don't fly hard or get things caught in the props or motor shaft that will make the motor heat up more than normal.  

How to determine whether a brushed motor needs to be replaced is a tough question and it really depends on your willingness to fly with a drone that isn't operating perfectly.  With mine, the telltale indicator is that I notice less power than usual and yaw is off a bit (twitchy or lethargic).  This makes sense since all motors perform to the level of the least capable motor.  If you experience less performance, first, ensure that it's not just the battery.  This is easy to do - just use a newer battery, or one that you know is still providing good power.  The next thing to do, if the battery checks out, is to replace the motors.  I recommend replacing all of the motors at once for brushed motors since they are all getting some form of wear while in use.  Replacing them all ensures that you are starting with peak performance.
",How do I tell when to replace the motors on my tinywhoop?,"I own a brushed micro quadcopter, more commonly known as a tiny whoop. I've read that brushed motors in general, and especially those used in such quadcopters, have a limited lifetime and that you should replace them when they near the end of that lifetime. 

However, as far as I can tell, there are no obvious signs that the motors have become too old to fly, as they don't break but instead their performance decreases over time. There's a maximum total runtime in hours listed for the motors, but I can't imagine any way to track how many hours the current set has been flown for besides writing down the length of each flight, which would be extremely tedious.

So how do I figure out whether my motors are worn out and should be replaced, or are still okay to fly with? 
",https://drones.stackexchange.com/questions/606/how-do-i-tell-when-to-replace-the-motors-on-my-tinywhoop
"There is actually no such thing as a 6-axis gyro; the correct term for this is ""IMU"", which stands for ""Inertial Measurement Unit"". An IMU is a device that combines several inertial sensors that measure the craft's orientation and position in space.

The 6-axis IMU is a composite sensor, which contains two different types of 3-axis sensors on one chip. Usually it is a 3-axis gyroscope (which measures the rate of rotation of whatever it's strapped onto) and a 3-axis accelerometer (which measures its linear acceleration). A 3-axis gyro, on the other hand, is just the gyro and nothing else, as a standalone chip. There are also standalone 3-axis accelerometers¹, but accelerometers are almost never used in flying vehicles alone, without gyroscopes.

The third type of sensor that an IMU can contain is a magnetometer, which measures the earth's magnetic field² and can be used to tell which way is north. A magnetometer can either be present as part of a 9-axis IMU, of another sensor (e.g. in a GPS unit) or an entirely standalone unit.
Do you need the accelerometer and magnetometer? Well, it depends.


For rate mode (or acro mode, as it's more commonly known), the aircraft only needs to know its rates of rotation along all three axes and matches them to the desired rates set by the pilot via stick positions. For this, just the gyro is sufficient.
However, in attitude, angle or autolevel mode (also sometimes called stabilized mode), in which the pilot defines the desired attitude(orientation) relative to the horizon, which the drone will match, a gyroscope alone is insufficient. The flight controller will need to know not only how fast it is currently spinning, but also which way ""down"" is relative to itself. Due to a phenomenon called integration drift³, the flight controller can't maintain this knowledge precisely enough with just a gyro. It needs an accelerometer on board to correct the gyroscope, so if you want to use these modes, you need both a gyroscope and an accelerometer.
A magnetometer (sometimes referred to as a compass) is required for navigation modes, where besides its attitude relative to the horizon the craft has to also know its heading relative to the geographical north. Note that since navigation modes also require GPS, you could forgo the builtin magnetometer in the flight controller, and get a GPS unit with a magnetometer in it instead. Or you can get both, one in the FC and one in the GPS, which will increase the accuracy of the readings. (actually, you can double the other two sensors for the same effect; some flight controllers are manufactured with a twin IMU for that purpose.)




¹: There are also single- and dual-axis versions of each type of sensor — which only means you'll need several of those to make up a complete IMU. They are rarely used nowadays, as the integrated versions are usually better in every way.

²: Or any other magnetic field, for that matter, which is why you need to keep it away from magnets and steel structures, otherwise you'll get rubbish. There's usually little metal in the air other than what's on your aircraft, though, so magnetometers tend to work quite well in UAVs unless you've got a magnet-latched canopy and put the FC next to it or something. Minimizing interference is also why magnetometers are usually integrated into GPS units and mounted as far away from the rest of the aircraft as possible.

³: Integration drift is an issue that plagues inertial navigation since the beginning of time, and is present everywhere where you can't measure something directly, but you can measure how fast it's changing instead (in other words, you can measure the derivative of that thing). So you integrate it (add up the changes over time) to get the original value. However, every measurement comes with an error, and the errors add up as well, so your total error will grow all the time and at some point it will get bigger than the original thing you were measuring.

Intuitively, integration drift is like walking in a forest. When you enter the forest, you (hopefully) have a sense of which way north (or some other reference direction) is. As you walk, you can maintain a sense of direction for some time (""I was walking towards the north, so it was in front of me, now I turned left, north must be to my right now""). However, since you don't know precisely how much degrees you turned, every turn you make will introduce a small error into your direction estimate, and those errors will add up over time. A couple hours later your sense of direction will have drifted far enough from the original that you might be heading in the opposite direction from where you think you're going. Even if you tried to just walk in a straight line all the time you would probably stray off course eventually, because without external reference you have no way of telling whether you've actually been walking in a straight line (this is known as zero drift).

The only way out of this is to have an alternative source of direction knowledge (e.g. a compass or the combination of the sun's position and time of day, or some other observable directionality in your environment like a distant mountain) which you check regularly and use that knowledge to correct the error in your ""internal"" sense of direction.

A quadcopter in angle mode has the same problem: to stay upright it needs to know is where ""up"" is, and a gyroscope can only measure (as an approximation) how much degrees it's been rotated from its previous orientation; it does not know (or care) what that previous orientation was. And even if the FC did know its previous orientation, the estimate might have drifted far off from the original. That's where the accelerometer comes in: its job is to measure the earth's gravity, and therefore the direction of ""down"", and use that information to figure out the initial orientation when the quadcopter is armed (like knowing where north is when entering the forest), as well as correcting possible drift of the orientation obtained from the gyros in flight.
",Difference between a 3 and 6 axis gyro,"When shopping for drones, I see a 3 and 6 axis gyro available, what is the difference between the two? Does one have a advantage when flying over another?
",https://drones.stackexchange.com/questions/592/difference-between-a-3-and-6-axis-gyro
"tl; dr:


Analog is: 


Cheaper;
Lower resolution;  
Has a noisier, more staticky picture that breaks up gradually when the signal gets weaker. Analog image breakup, while unpleasant to the eye, is generally easier to see through.
Has a constant low latency; 
Is an entirely open standard, with anyone free to produce compatible equipment

Digital is:


Currently rather expensive,
Has (significantly) higher resolution, 
Has a way cleaner image, usually without a speck of static right up to the very limit of its range, but when it starts breaking up, it does so suddenly and in weird ways. The broken image is usually harder to see through than an analog signal. With DJI, for instance, the picture will suddenly get very blocky and low-res when it gets out of range.
Also, digital systems can have inconsistent latency that changes in flight (DJI in particular is known for this), although this mostly concerns the highest-performance pilots, such as racers.
The only digital system currently in widespread use is the DJI system, which is a proprietary standard with only two manufacturers authorized to make the gear.



Analog and digital systems have about the same usable range per unit of VTX power.

To compare how they look, it's better to just see the videos:


DJI HD system range &amp; breakup vs analog
ByteFrost image &amp; breakup




How they work and the reasons for noise/breakup related differences:

Anything that is encoded in a radio signal at a point in time can be represented as a level, which can be higher or lower; Thus the ""primary"" information encoded in the signal can be represented as a graph of this level over time:



In an analog system that level can take any value, within some range, which we'll think of as 0 to 100% for simplicity(*). It can be 20%, 70% or 48.573498%, theoretically to any degree of accuracy. The drawback to that is that any noise that's floating around in the radio spectrum will add to whatever signal you're receiving, so in practice, you'll get something like 40% (true signal) + 5% (noise) = 45% (received signal), and since the original signal could be anything, the receiver has no way of knowing which part of what it got is noise.

The image that your goggles receive is made up of pixels, and the color that each of them has is encoded as percentages of red, green and blue: zero to 100%. An analog TV system encodes this picture by ""scanning"" over all of the pixels in sequence, line by line, and setting the signal's level equal to each pixel's brightness in turn. For example, this oscilloscope picture represents the TV signal for the ""colored bars"" picture:

 

The ladder you see represents how the brightness level of the pixels changes from left to right in each line of the image.
There are also other signals overlaid on top of it, these correspond to the lines closer to the bottom of the image, which have other sequences of colors in them (the oscilloscope displays all the lines together on one screen).

The consequence of all that is that whenever there's another signal on your frequency around, it gets added to your VTX's signal and through that directly to your picture. Since usually that other signal is noise(**), your picture is overlaid with noise.
When your signal is strong, the noise is a very small percentage of it and is usually unnoticeable by the eye. As the useful signal gets weaker, though, the noise (which stays the same) will get stronger compared to it, so the percentage of noise in your picture increases. At some point, it will become so strong that you couldn't see any useful signal in the picture anymore.

In a digital system, however, only two levels are available: 0 and 1, represented by 0% or 100%(***). The image is encoded into a sequence of bits using a special algorithm, called a codec, and decoded from that sequence on the other end, almost exactly like online video. Besides simply encoding the video feed, one of the most important functions of modern codecs is to compress it, so that it can be communicated in a significantly smaller amount of bits, which in turn means that higher-resolution video can be transmitted with the same bitrate (number of bits sent per second).

Since radio signals are by their nature analog, on the receiving end noise will still be added to the signal, so if a 0 was transmitted and 10% of noise is added by the environment, the received result is 10% — but since the receiver knows that only either 0 or 100% could have been transmitted, it picks the closest possible level, in this case, 0.

This means that when you transmit digital data, noise is just ignored until a certain point: Even when noise levels are as high as half of the analog signal (which creates a picture that's rather hard to parse), with digital you receive exactly the same information as you would if there were no noise, with the resulting video perfectly clear. However, when the relative noise level does pass the critical threshold, ones will start suddenly (and randomly) becoming zeroes and vice-versa. What happens to the video after that depends on the particular digital system and how the video is encoded in it. 

With the DJI system, the whole screen suddenly becomes low-res and blocky, occasionally skipping frames, and the latency increases. The cumulative effect of this can range from ""just an unpleasant-looking image"" to ""totally unflyable"".



With Fatshark's Bytefrost system (currently in development/beta testing), random bits of the image will flash with colored blocks, while the rest remains high-resolution. The manufacturer touts this ""analog-like"" style of image breakup as a feature of the system.



In both cases, digital breakup, when it does happen, is arguably harder to see through than analog breakup, because our brain still has better error correction software than seen in these systems. This is also due to the fact that digital images, while crystal clear up to a point, start breaking up sharply after that point and quickly get to ""very hard to parse"" levels, while an analog picture is already quite static-ridden by then and just continues to gradually get worse.

That said, digital systems can employ error-correcting codes and other tricks to be able to recover from a certain percentage of errors, at the expense of reduced bitrates, yielding a lower-quality image which can be decoded from a longer distance.  you'll typically see them start to gradually reduce image quality before breaking down completely, giving you some warning signs that you are going out of range. There is also usually a link health indicator somewhere in the corner that is similar to the RSSI reading for RC control systems which you could look at to see if you're going out of range. You probably aren't going to be looking at it all the time, though, and a low signal indication can be missed, while it's hard to miss an image full of static and getting worse.



Footnotes:


(*): The analog signal can technically be any real number, and can sometimes go beyond its designated range, i.e. in our example be less than 0 or bigger than 100%. How the system handles the signal going out of its designated boundaries is the system's business.
(**): the other common kind of interfering signal is your own signal that's reflected off of something. In which case you will get two of the same picture overlaid on top of each other, but one of them which is slightly late and is shifted to the right because of that. This is called multipath interference, or multipathing, and is a major source of image degradation with analog FPV systems. Cutting down on multipath signals is also the primary reason why circular-polarized antennae are used in FPV..
(***): Actually, a digital system can have more than two values, and there are different ways of representing them as analog levels; the main distinguishing factor is that there's a fixed (integer) number of them. For example, for a simple digital system with 4 levels, they would be 0, 33%, 66%, and 100%, with corresponding ranges of -∞ to 16%, 16-50%, 50-83%, and 83%-∞.

",Difference between analog and digital FPV systems?,"The new DJI digital FPV system and a few other systems are using a digital signal for FPV video. How is this different from a traditional analog signal for FPV drones?
",https://drones.stackexchange.com/questions/637/difference-between-analog-and-digital-fpv-systems
"OpenTX can be built from source for your receiver using various compile options which may be useful.

Enabling USB_SERIAL and CLI will allow connection to your pc using a serial connection, which you can use for bidirectional communication.

You will need to add code to the OpenTX firmware to accept commands from the pc, to control the radio. It may be simplest to utilize the trainer variables to control the outputs.

The changes required are:

in cli.cpp, connect the serial to the trainer variables:

int cliSet(const char ** argv)
{
  if (!strcmp(argv[1], ""trainer""))
  {
    int thr;
    int chan;
    if ( (toInt(argv, 2, &amp;chan) &gt; 0)
       &amp;&amp;(toInt(argv, 3, &amp;thr) &gt; 0))
    {
        ppmInput[chan] = thr;
        ppmInputValidityTimer = 240;//PPM_IN_VALID_TIMEOUT;
        serialPrint(""!"");
    }
  }
  ...cliSet continues
}


in mixer.cpp, enable all trainer channels by default:

// comment out this check
//        &amp;&amp; isFunctionActive(FUNCTION_TRAINER_STICK1+ch)


in trainer.cpp, clear all trainer signals after timeout:

void checkTrainerSignalWarning()
{
   ...
   else if (!ppmInputValidityTimer &amp;&amp; (ppmInputValidState == PPM_IN_IS_VALID))
   {
      ppmInputValidState = PPM_IN_INVALID;
      AUDIO_TRAINER_LOST();
      memset(ppmInput, 0, sizeof(ppmInput));   //clear all trainer inputs
   }
   ...
 }


You should then be able to use commands over serial such as:

set trainer 1 500


to control channel 1 to a value of 500
",Control opentx transmitter from pc?,"is a standard way to control a physical aircraft by connecting a frsky transmitter to a PC?

I do NOT want to use the transmitter to control a flight Sim etc.

I'd like to write autopilot software myself, and have it running on a PC. Id like to connect the PC to the transmitter, and have it send inputs to the aircraft, and also send telemetry back.

I'd rather not use an ardupilot.

Anyone have a link to details of someone doing this before?

Tldr: can I use a keyboard to control an aircraft with a frsky transmitter? 
",https://drones.stackexchange.com/questions/1321/control-opentx-transmitter-from-pc
